input,output
"LightGBM Core Parameters
LightGBM Core Parameters are fundamental settings that govern the behavior and performance of LightGBM models during training. These parameters control various aspects of the model, including its structure, optimization process, and objective function. Core parameters are essential for fine-tuning the model’s performance and behavior to suit specific machine learning tasks. Examples of core parameters include learning rate, number of leaves, maximum depth, regularization terms, and optimization strategies. Understanding and tuning these parameters are crucial for achieving optimal model performance with LightGBM.
objective: Specifies the loss function to optimize during training. LightGBM supports various objectives such as regression, binary classification, and multiclass classification.
task : It specifies the task we wish to perform which is either train or prediction. The default entry is train. Another possible value for this parameter is prediction.
num_leaves: Specifies the maximum number of leaves in each tree. Higher values allow the model to capture more complex patterns but may lead to overfitting.
learning_rate: Determines the step size at each iteration during gradient descent. Lower values result in slower learning but may improve generalization.
max_depth: Sets the maximum depth of each tree. Higher values allow the model to capture more intricate interactions but may lead to overfitting.
min_data_in_leaf: Specifies the minimum number of data points required to form a leaf node. Higher values help prevent overfitting but may result in underfitting.
num_iterations : It specifies the number of iterations to be performed. The default value is 100.
feature_fraction: Controls the fraction of features to consider when building each tree. Randomly selecting a subset of features helps improve model diversity and reduce overfitting.
bagging_fraction: Specifies the fraction of data to be used for bagging (sampling data points with replacement) during training. It helps improve model robustness and reduce variance.
lambda_l1 and lambda_l2: Regularization parameters that control L1 and L2 regularization, respectively. They penalize large coefficients to prevent overfitting.
min_split_gain: Specifies the minimum gain required to split a node further. It helps control the tree’s growth and prevents unnecessary splits.
categorical_feature : It specifies the categorical feature used for training model.","LightGBM Core Parameters are essential settings that govern the behavior and performance of LightGBM models during training, including parameters such as learning rate, number of leaves, maximum depth, regularization terms, and optimization strategies, crucial for achieving optimal model performance."
"Time series data is a sequence of data points recorded or collected at regular time intervals. It is a type of data that tracks the evolution of a variable over time, such as sales, stock prices, temperature, etc. The regular time intervals can be daily, weekly, monthly, quarterly, or annually, and the data is often represented as a line graph or time-series plot. Time series data is commonly used in fields such as economics, finance, weather forecasting, and operations management, among others, to analyze trends, and patterns, and to make predictions or forecasts.

Components of Time Series Data
The components of time series data are the underlying patterns or structures that make up the data. There are several common components in time series data. In time series data, there are several types of patterns that can occur:

Trend: A long-term upward or downward movement in the data, indicating a general increase or decrease over time.
Seasonality: A repeating pattern in the data that occurs at regular intervals, such as daily, weekly, monthly, or yearly.
Cycle: A pattern in the data that repeats itself after a specific number of observations, which is not necessarily related to seasonality.
Irregularity: Random fluctuations in the data that cannot be easily explained by trend, seasonality, or cycle.
Autocorrelation: The correlation between an observation and a previous observation in the same time series.
Outliers: Extreme observations that are significantly different from the other observations in the data.
Noise: Unpredictable and random variations in the data.
By identifying these patterns in time series data, analysts can better understand the underlying structure and make more accurate forecasts.","Time series data consists of data points recorded at regular intervals, often representing variables evolving over time, and its components include trend, seasonality, cycle, irregularity, autocorrelation, outliers, and noise, crucial for analyzing patterns and making forecasts in fields like economics, finance, and weather forecasting."
"Trend
A trend in time series data refers to a long-term upward or downward movement in the data, indicating a general increase or decrease over time. The trend represents the underlying structure of the data, capturing the direction and magnitude of change over a longer period. In time series analysis, it is common to model and remove the trend from the data to better understand the underlying patterns and make more accurate forecasts. There are several types of trends in time series data:

Upward Trend: A trend that shows a general increase over time, where the values of the data tend to rise over time.
Downward Trend: A trend that shows a general decrease over time, where the values of the data tend to decrease over time.
Horizontal Trend: A trend that shows no significant change over time, where the values of the data remain constant over time.
Non-linear Trend: A trend that shows a more complex pattern of change over time, including upward or downward trends that change direction or magnitude over time.
Damped Trend: A trend that shows a gradual decline in the magnitude of change over time, where the rate of change slows down over time.
It’s important to note that time series data can have a combination of these types of trends or multiple trends present simultaneously. Accurately identifying and modeling the trend is a crucial step in time series analysis, as it can significantly impact the accuracy of forecasts and the interpretation of patterns in the data.","A trend in time series data represents a long-term movement, either upward, downward, horizontal, non-linear, or damped, reflecting the underlying direction and magnitude of change over time, crucial for understanding patterns and making accurate forecasts in time series analysis."
"Seasonality
Seasonality in time series data refers to patterns that repeat over a regular time period, such as a day, a week, a month, or a year. These patterns arise due to regular events, such as holidays, weekends, or the changing of seasons, and can be present in various types of time series data, such as sales, weather, or stock prices.

There are several types of seasonality in time series data, including:

Weekly Seasonality: A type of seasonality that repeats over a 7-day period and is commonly seen in time series data such as sales, energy usage, or transportation patterns.
Monthly Seasonality: A type of seasonality that repeats over a 30- or 31-day period and is commonly seen in time series data such as sales or weather patterns.
Annual Seasonality: A type of seasonality that repeats over a 365- or 366-day period and is commonly seen in time series data such as sales, agriculture, or tourism patterns.
Holiday Seasonality: A type of seasonality that is caused by special events such as holidays, festivals, or sporting events and is commonly seen in time series data such as sales, traffic, or entertainment patterns.","Seasonality in time series data refers to repeating patterns over regular time intervals, such as daily, weekly, monthly, or yearly, influenced by events like holidays or changing seasons, commonly observed in various data types like sales, weather, or stock prices."
"Cyclicity
Cyclicity in time series data refers to the repeated patterns or periodic fluctuations that occur in the data over a specific time interval. It can be due to various factors such as seasonality (daily, weekly, monthly, yearly), trends, and other underlying patterns.

Difference between Seasonality and Cyclicity
Seasonality refers to a repeating pattern in the data that occurs over a fixed time interval, such as daily, weekly, monthly, or yearly. Seasonality is a predictable and repeating pattern that can be due to various factors such as weather, holidays, and human behavior.

Cyclicity, on the other hand, refers to the repeated patterns or fluctuations that occur in the data over an unspecified time interval. These patterns can be due to various factors such as economic cycles, trends, and other underlying patterns. Cyclicity is not limited to a fixed time interval and can be of different frequencies, making it harder to identify and model.","Cyclicity in time series data involves periodic fluctuations that occur over unspecified time intervals, influenced by factors like economic cycles, trends, and other underlying patterns, distinguishing it from seasonality which involves repeating patterns over fixed time intervals."
"Autocorrelation
Autocorrelation in time series data refers to the degree of similarity between observations in a time series as a function of the time lag between them. Autocorrelation is a measure of the correlation between a time series and a lagged version of itself. In other words, it measures how closely related the values in the time series are to each other at different time lags.

Autocorrelation is a useful tool for understanding the properties of a time series, as it can provide information about the underlying patterns and dependencies in the data. For example, if a time series is positively autocorrelated at a certain time lag, this suggests that a positive value in the time series is likely to be followed by another positive value a certain amount of time later. On the other hand, if a time series is negatively autocorrelated at a certain time lag, this suggests that a positive value in the time series is likely to be followed by a negative value a certain amount of time later.

Autocorrelation can be computed using various statistical techniques, such as the Pearson correlation coefficient or the autocorrelation function (ACF). The autocorrelation function provides a graphical representation of the autocorrelation for different time lags and can be used to identify the dominant patterns and dependencies in the time series.","Autocorrelation in time series data measures the similarity between observations at different time lags, providing insights into underlying patterns and dependencies within the data."
"Outliers
Outliers in time series data are data points that are significantly different from the rest of the data points in the series. These can be due to various reasons such as measurement errors, extreme events, or changes in underlying data-generating processes. Outliers can have a significant impact on the results of time series analysis and modeling, as they can skew the statistical properties of the data.

Noise
Noise in time series data refers to random fluctuations or variations that are not due to an underlying pattern or trend. It is typically considered as any unpredictable and random variation in the data. These fluctuations can arise from various sources such as measurement errors, random fluctuations in the underlying process, or errors in data recording or processing. The presence of noise can make it difficult to identify the underlying trend or pattern in the data, and therefore it is important to remove or reduce the noise before any further analysis.","Outliers in time series data are extreme data points significantly deviating from the majority, while noise refers to random fluctuations disrupting the underlying patterns, both requiring attention in analysis and modeling for accurate insights."
"What is the Purpose of Python Data Visualization?
Matplotlib is a powerful plotting library in Python used for creating static, animated, and interactive visualizations. Its primary purpose is to provide users with the tools and functionality to represent data graphically, making it easier to analyze and understand.

Data visualization serves several important purposes:

Facilitating Understanding: Visual representations of data make it easier to understand complex datasets. Instead of poring over rows and columns of numbers, visualizations provide a clear and intuitive way to interpret information.
Identifying Patterns and Trends: Visualizations allow us to identify patterns, trends, and relationships within data that might not be immediately apparent from the raw data alone. By visualizing data, we can uncover insights that drive decision-making and strategy.
Communicating Insights: Visualizations are powerful tools for communicating insights to stakeholders, whether they are technical experts or non-technical audiences. Charts and graphs can convey complex information in a digestible format, facilitating communication and collaboration.
Spotting Anomalies and Outliers: Visualizations make it easier to spot anomalies, outliers, and unusual patterns in data. By visually inspecting data, analysts can quickly identify data points that deviate from the norm and investigate them further.
Exploratory Data Analysis: Visualizations play a crucial role in exploratory data analysis (EDA), allowing analysts to explore datasets and generate hypotheses. By creating visualizations, analysts can interactively explore data, test assumptions, and refine their understanding of the underlying patterns.","Python data visualization, facilitated by libraries like Matplotlib, aims to provide intuitive graphical representations of data, aiding in understanding complex datasets, identifying patterns, communicating insights, detecting anomalies, and conducting exploratory data analysis."