input,output
"The essence of Natural Language Processing lies in making computers understand the natural language. That’s not an easy task though. Computers can understand the structured form of data like spreadsheets and the tables in the database, but human languages, texts, and voices form an unstructured category of data, and it gets difficult for the computer to understand it, and there arises the need for Natural Language Processing. There’s a lot of natural language data out there in various forms and it would get very easy if computers can understand and process that data. We can train the models in accordance with expected output in different ways. Humans have been writing for thousands of years, there are a lot of literature pieces available, and it would be great if we make computers understand that. But the task is never going to be easy. There are various challenges floating out there like understanding the correct meaning of the sentence, correct Named-Entity Recognition(NER), correct prediction of various parts of speech, coreference resolution(the most challenging thing in my opinion). Computers can’t truly understand the human language. If we feed enough data and train a model properly, it can distinguish and try categorizing various parts of speech(noun, verb, adjective, supporter, etc…) based on previously fed data and experiences. If it encounters a new word it tried making the nearest guess which can be embarrassingly wrong few times. It’s very difficult for a computer to extract the exact meaning from a sentence. For example – The boy radiated fire like vibes. The boy had a very motivating personality or he actually radiated fire? As you see over here, parsing English with a computer is going to be complicated. There are various stages involved in training a model. Solving a complex problem in Machine Learning means building a pipeline. In simple terms, it means breaking a complex problem into a number of small problems, making models for each of them and then integrating these models. A similar thing is done in NLP. We can break down the process of understanding English for a model into a number of small pieces. It would be really great if a computer could understand that San Pedro is an island in Belize district in Central America with a population of 16, 444 and it is the second largest town in Belize. But to make the computer understand this, we need to teach computer very basic concepts of written language. So let’s start by creating an NLP pipeline. It has various steps which will give us the desired output(maybe not in a few rare cases) at the end.","The essence of Natural Language Processing lies in enabling computers to comprehend and process unstructured human language data, presenting challenges such as correct understanding of sentence meaning, Named-Entity Recognition, parts of speech prediction, and coreference resolution, necessitating the construction of complex NLP pipelines to break down the understanding process into manageable components."
"Natural Language Processing (NLP) is a field of Artificial Intelligence (AI) that deals with the interaction between computers and human languages. NLP is used to analyze, understand, and generate natural language text and speech. The goal of NLP is to enable computers to understand and interpret human language in a way that is similar to how humans process language.

Natural Language Processing (NLP) is a field of computer science and artificial intelligence that focuses on the interaction between computers and humans using natural language. It involves analyzing, understanding, and generating human language data, such as text and speech.
NLP has a wide range of applications, including sentiment analysis, machine translation, text summarization, chatbots, and more. Some common tasks in NLP include:
Text Classification: Classifying text into different categories based on their content, such as spam filtering, sentiment analysis, and topic modeling.
Named Entity Recognition (NER): Identifying and categorizing named entities in text, such as people, organizations, and locations.
Part-of-Speech (POS) Tagging: Assigning a part of speech to each word in a sentence, such as noun, verb, adjective, and adverb.
Sentiment Analysis: Analyzing the sentiment of a piece of text, such as positive, negative, or neutral.
Machine Translation: Translating text from one language to another.
NLP involves the use of several techniques, such as machine learning, deep learning, and rule-based systems. Some popular tools and libraries used in NLP include NLTK (Natural Language Toolkit), spaCy, and Gensim.
Overall, NLP is a rapidly growing field with many practical applications, and it has the potential to revolutionize the way we interact with computers and machines using natural language.","Natural Language Processing (NLP) is a branch of artificial intelligence focused on enabling computers to analyze, understand, and generate human language text and speech, facilitating various applications such as sentiment analysis, machine translation, and text classification."
"NLP techniques are used in a wide range of applications, including:
Speech recognition and transcription: NLP techniques are used to convert speech to text, which is useful for tasks such as dictation and voice-controlled assistants.
Language translation: NLP techniques are used to translate text from one language to another, which is useful for tasks such as global communication and e-commerce.
Text summarization: NLP techniques are used to summarize long text documents into shorter versions, which is useful for tasks such as news summarization and document indexing.
Sentiment analysis: NLP techniques are used to determine the sentiment or emotion expressed in text, which is useful for tasks such as customer feedback analysis and social media monitoring.
Question answering: NLP techniques are used to answer questions asked in natural language, which is useful for tasks such as chatbots and virtual assistants.
NLP is a rapidly growing field and it is being used in many industries such as healthcare, education, e-commerce, and customer service. NLP is also used to improve the performance of natural language-based systems like chatbot, virtual assistants, recommendation systems, and more. With the advancement in NLP, it has become possible for computers to understand and process human languages in a way that can be used for various applications such as speech recognition, language translation, question answering, and more.","NLP techniques are widely utilized across various industries, enabling applications such as speech recognition, language translation, text summarization, sentiment analysis, and question answering, with advancements continuously enhancing the capabilities of natural language processing systems."
"Advantages of Natural Language Processing:

Improves human-computer interaction: NLP enables computers to understand and respond to human languages, which improves the overall user experience and makes it easier for people to interact with computers.
Automates repetitive tasks: NLP techniques can be used to automate repetitive tasks, such as text summarization, sentiment analysis, and language translation, which can save time and increase efficiency.
Enables new applications: NLP enables the development of new applications, such as virtual assistants, chatbots, and question answering systems, that can improve customer service, provide information, and more.
Improves decision-making: NLP techniques can be used to extract insights from large amounts of unstructured data, such as social media posts and customer feedback, which can improve decision-making in various industries.
Improves accessibility: NLP can be used to make technology more accessible, such as by providing text-to-speech and speech-to-text capabilities for people with disabilities.
Facilitates multilingual communication: NLP techniques can be used to translate and analyze text in different languages, which can facilitate communication between people who speak different languages.
Improves information retrieval: NLP can be used to extract information from large amounts of data, such as search engine results, to improve information retrieval and provide more relevant results.
Enables sentiment analysis: NLP techniques can be used to analyze the sentiment of text, such as social media posts and customer reviews, which can help businesses understand how customers feel about their products and services.
Improves content creation: NLP can be used to generate content, such as automated article writing, which can save time and resources for businesses and content creators.
Supports data analytics: NLP can be used to extract insights from text data, which can support data analytics and improve decision-making in various industries.
Enhances natural language understanding: NLP research and development can lead to improved natural language understanding, which can benefit various industries and applications.","Natural Language Processing (NLP) offers numerous advantages including improved human-computer interaction, task automation, facilitation of new applications, enhanced decision-making, accessibility improvements, multilingual communication support, information retrieval enhancement, sentiment analysis capabilities, content creation assistance, data analytics support, and continuous advancements in natural language understanding."
"Disadvantages of Natural Language Processing:

Limited understanding of context: NLP systems have a limited understanding of context, which can lead to misinterpretations or errors in the output.
Requires large amounts of data: NLP systems require large amounts of data to train and improve their performance, which can be expensive and time-consuming to collect.
Limited ability to understand idioms and sarcasm: NLP systems have a limited ability to understand idioms, sarcasm, and other forms of figurative language, which can lead to misinterpretations or errors in the output.
Limited ability to understand emotions: NLP systems have a limited ability to understand emotions and tone of voice, which can lead to misinterpretations or errors in the output.
Difficulty with multi-lingual processing: NLP systems may struggle to accurately process multiple languages, especially if they are vastly different in grammar or structure.
Dependency on language resources: NLP systems heavily rely on language resources, such as dictionaries and corpora, which may not always be available or accurate for certain languages or domains.
Difficulty with rare or ambiguous words: NLP systems may struggle to accurately process rare or ambiguous words, which can lead to errors in the output.
Lack of creativity: NLP systems are limited to processing and generating output based on patterns and rules, and may lack the creativity and spontaneity of human language use.
Ethical considerations: NLP systems may perpetuate biases and stereotypes, and there are ethical concerns around the use of NLP in areas such as surveillance and automated decision-making.","Natural Language Processing (NLP) faces challenges including limited contextual understanding, data dependency, difficulty with idioms and emotions, language diversity issues, reliance on resources, ambiguity handling, lack of creativity, and ethical concerns."
"Data Processing is the task of converting data from a given form to a much more usable and desired form i.e. making it more meaningful and informative. Using Machine Learning algorithms, mathematical modeling, and statistical knowledge, this entire process can be automated. The output of this complete process can be in any desired form like graphs, videos, charts, tables, images, and many more, depending on the task we are performing and the requirements of the machine. This might seem to be simple but when it comes to massive organizations like Twitter, Facebook, Administrative bodies like Parliament, UNESCO, and health sector organizations, this entire process needs to be performed in a very structured manner. So, the steps to perform are as follows: 

Data processing is a crucial step in the machine learning (ML) pipeline, as it prepares the data for use in building and training ML models. The goal of data processing is to clean, transform, and prepare the data in a format that is suitable for modeling.

The main steps involved in data processing typically include:

1.Data collection: This is the process of gathering data from various sources, such as sensors, databases, or other systems. The data may be structured or unstructured, and may come in various formats such as text, images, or audio.
2.Data preprocessing: This step involves cleaning, filtering, and transforming the data to make it suitable for further analysis. This may include removing missing values, scaling or normalizing the data, or converting it to a different format.

3.Data analysis: In this step, the data is analyzed using various techniques such as statistical analysis, machine learning algorithms, or data visualization. The goal of this step is to derive insights or knowledge from the data.

4.Data interpretation: This step involves interpreting the results of the data analysis and drawing conclusions based on the insights gained. It may also involve presenting the findings in a clear and concise manner, such as through reports, dashboards, or other visualizations.
5.Data storage and management: Once the data has been processed and analyzed, it must be stored and managed in a way that is secure and easily accessible. This may involve storing the data in a database, cloud storage, or other systems, and implementing backup and recovery strategies to protect against data loss.

6.Data visualization and reporting: Finally, the results of the data analysis are presented to stakeholders in a format that is easily understandable and actionable. This may involve creating visualizations, reports, or dashboards that highlight key findings and trends in the data.
summarise in one sentence","Data processing in the machine learning pipeline involves collecting, preprocessing, analyzing, interpreting, storing, visualizing, and reporting data to prepare it for building and training ML models."
"Advantages of data processing in Machine Learning:
Improved model performance: Data processing helps improve the performance of the ML model by cleaning and transforming the data into a format that is suitable for modeling.
Better representation of the data: Data processing allows the data to be transformed into a format that better represents the underlying relationships and patterns in the data, making it easier for the ML model to learn from the data.
Increased accuracy: Data processing helps ensure that the data is accurate, consistent, and free of errors, which can help improve the accuracy of the ML model.","Data processing in machine learning enhances model performance, representation of data, and accuracy by cleaning, transforming, and ensuring data consistency."
"Disadvantages of data processing in Machine Learning:
Time-consuming: Data processing can be a time-consuming task, especially for large and complex datasets.
Error-prone: Data processing can be error-prone, as it involves transforming and cleaning the data, which can result in the loss of important information or the introduction of new errors.
Limited understanding of the data: Data processing can lead to a limited understanding of the data, as the transformed data may not be representative of the underlying relationships and patterns in the data.","Data processing in machine learning can be time-consuming, error-prone, and may result in a limited understanding of the data due to the complexities involved in transforming and cleaning large datasets."
"Decision Tree is one of the most powerful and popular algorithms. Python Decision-tree algorithm falls under the category of supervised learning algorithms. It works for both continuous as well as categorical output variables. In this article, We are going to implement a Decision tree in Python algorithm on the Balance Scale Weight & Distance Database presented on the UCI.

Decision Tree
A Decision tree is a tree-like structure that represents a set of decisions and their possible consequences. Each node in the tree represents a decision, and each branch represents an outcome of that decision. The leaves of the tree represent the final decisions or predictions.

Decision trees are created by recursively partitioning the data into smaller and smaller subsets. At each partition, the data is split based on a specific feature, and the split is made in a way that maximizes the information gain.

In the above figure, decision tree is a flowchart-like tree structure that is used to make decisions. It consists of Root Node(WINDY), Internal nodes(OUTLOOK, TEMPERATURE), which represent tests on attributes, and leaf nodes, which represent the final decisions. The branches of the tree represent the possible outcomes of the tests.","A Decision Tree is a supervised learning algorithm that recursively partitions data into smaller subsets based on specific features to make predictions, represented by a tree-like structure consisting of root nodes, internal nodes, and leaf nodes."
"User
While implementing the decision tree in Python we will go through the following two phases:

Building Phase
Preprocess the dataset.
Split the dataset from train and test using Python sklearn package.
Train the classifier.
Operational Phase
Make predictions.
Calculate the accuracy.
Data Import
To import and manipulate the data we are using the pandas package provided in python.
Here, we are using a URL which is directly fetching the dataset from the UCI site no need to download the dataset. When you try to run this code on your system make sure the system should have an active Internet connection.
As the dataset is separated by “,” so we have to pass the sep parameter’s value as “,”.
Another thing is notice is that the dataset doesn’t contain the header so we will pass the Header parameter’s value as none. If we will not pass the header parameter then it will consider the first line of the dataset as the header.
Data Slicing
Before training the model we have to split the dataset into the training and testing dataset.
To split the dataset for training and testing we are using the sklearn module train_test_split
First of all we have to separate the target variable from the attributes in the dataset.","In the implementation of the decision tree in Python, two main phases involve building the model by preprocessing the dataset, splitting it into training and testing sets, and training the classifier, followed by the operational phase of making predictions, calculating accuracy, and utilizing the pandas package for data import and manipulation, as well as the sklearn module for data slicing and splitting."
"Gradient Boosting is a popular boosting algorithm in machine learning used for classification and regression tasks. Boosting is one kind of ensemble Learning method which trains the model sequentially and each new model tries to correct the previous model. It combines several weak learners into strong learners. There is two most popular boosting algorithm i.e

AdaBoost
Gradient Boosting
Gradient Boosting
Gradient Boosting is a powerful boosting algorithm that combines several weak learners into strong learners, in which each new model is trained to minimize the loss function such as mean squared error or cross-entropy of the previous model using gradient descent. In each iteration, the algorithm computes the gradient of the loss function with respect to the predictions of the current ensemble and then trains a new weak model to minimize this gradient. The predictions of the new model are then added to the ensemble, and the process is repeated until a stopping criterion is met.

In contrast to AdaBoost, the weights of the training instances are not tweaked, instead, each predictor is trained using the residual errors of the predecessor as labels. There is a technique called the Gradient Boosted Trees whose base learner is CART (Classification and Regression Trees). The below diagram explains how gradient-boosted trees are trained for regression problems.","Gradient Boosting is a powerful ensemble learning algorithm that sequentially trains weak models to minimize the loss function of the previous model using gradient descent, resulting in a strong learner combining the predictions of multiple weak models."
"Catboost is a variant of gradient boosting that can handle both categorical and numerical features. It does not require any feature encodings techniques like One-Hot Encoder or Label Encoder to convert categorical features into numerical features. It also uses an algorithm called symmetric weighted quantile sketch(SWQS) which automatically handles the missing values in the dataset to reduce overfitting and improve the overall performance of the dataset. 

Features of CatBoost 
Built-in Method for handling categorical features: CatBoost efficiently handles categorical features without requiring preprocessing. This capability eliminates the need to convert non-numeric factors into numerical values, simplifying the data preparation process.
Excellent result without parameter tuning: CatBoost aims to provide excellent results without the need for extensive parameter tuning. This feature saves time and effort for users, as they can achieve competitive performance with default parameters.
Built-in methods for Handling missing values: Unlike other Models, CatBoost can handle missing values in the input data without requiring imputation.
Automatic feature scaling: CatBoost internal scales all the columns to the same scaling whereas in other models we need to convert columns extensively.
Robust to Overfitting: CatBoost implements a variety of techniques to prevent overfitting, such as robust tree boosting, ordered boosting, and the use of random permutations for feature combinations. These techniques help in building models that generalize well to unseen data.
Built-in cross-validation – CatBoost internally applies a cross-validation method to choose the best hyperparameters for the model.
Fast and scalable GPU version: CatBoost offers a GPU-accelerated version of its algorithm, allowing users to train models quickly on large datasets. The GPU implementation enhances scalability and performance, especially when dealing with multi-card configurations.","CatBoost is a gradient boosting variant that efficiently handles categorical features, missing values, and feature scaling, while also providing robustness to overfitting and offering built-in cross-validation and GPU acceleration for fast training on large datasets."
"What is LightGBM?
LightGBM is an open-source, distributed, high-performance gradient boosting framework developed by Microsoft. It is designed for efficiency, scalability, and accuracy. It is based on decision trees designed to improve model efficiency and reduce memory usage. It incorporates several novel techniques, including Gradient-based One-Side Sampling (GOSS), which selectively retains instances with large gradients during training to optimize memory usage and training time. Additionally, LightGBM employs histogram-based algorithms for efficient tree construction. These techniques, along with optimizations like leaf-wise tree growth and efficient data storage formats, contribute to LightGBM’s efficiency and give it a competitive edge over other gradient boosting frameworks.","LightGBM is an open-source, high-performance gradient boosting framework developed by Microsoft, designed for efficiency, scalability, and accuracy, incorporating novel techniques like Gradient-based One-Side Sampling (GOSS) and histogram-based algorithms for efficient tree construction."
