input,output
"Regularization is a set of methods for reducing overfitting in machine learning models. Typically, regularization trades a marginal decrease in training accuracy for an increase in generalizability.

Regularization encompasses a range of techniques to correct for overfitting in machine learning models. As such, regularization is a method for increasing a model’s generalizability—that is, it’s ability to produce accurate predictions on new datasets.1 Regularization provides this increased generalizability at the sake of increased training error. In other words, regularization methods typically lead to less accurate predictions on training data but more accurate predictions on test data.

Regularization differs from optimization. Essentially, the former increases model generalizability while the latter increases model training accuracy. Both are important concepts in machine learning and data science.

There are many forms of regularization. Anything in the way of a complete guide requires a much longer book-length treatment. Nevertheless, this article provides an overview of the theory necessary to understand regularization’s purpose in machine learning as well as a survey of several popular regularization techniques.","Regularization techniques aim to mitigate overfitting in machine learning models by sacrificing a small reduction in training accuracy for improved generalizability, resulting in more accurate predictions on unseen data. These methods differ from optimization, which primarily focuses on enhancing training accuracy, and encompass various approaches to address overfitting effectively."
"Resume parsing refers to the automated storage, organization and analysis of job resumes. Resume parsing software provides companies an efficient way to identify keywords, skills, and so forth, in order to sort through large quantities of applications to identify the best applicants.

Why use resume parsing?
Recruiters use resume parsers in order to streamline the resume and applicant screening process. Parsing technology allows recruiters to electronically gather, store, and organize large quantities of resumes. Once acquired, the resume data can be easily searched through and analyzed.

Resume parsing tools are part of most Applicant Tracking Software (ATS) platforms. By some estimates, the best resume parsing technology not only works exponentially quicker than human resume processing, converting hours of labor into seconds, but can replicate human accuracy at a rate of 95%.","Resume parsing automates the extraction and analysis of resume data, enabling recruiters to quickly identify relevant information such as keywords and skills. Integrated into Applicant Tracking Software (ATS) platforms, these tools expedite the screening process, offering both speed and accuracy, significantly reducing the time and effort required for candidate evaluation."
"k-means clustering is a method of vector quantization, originally from signal processing, that aims to partition n observations into k clusters in which each observation belongs to the cluster with the nearest mean (cluster centers or cluster centroid), serving as a prototype of the cluster. This results in a partitioning of the data space into Voronoi cells. k-means clustering minimizes within-cluster variances (squared Euclidean distances), but not regular Euclidean distances, which would be the more difficult Weber problem: the mean optimizes squared errors, whereas only the geometric median minimizes Euclidean distances. For instance, better Euclidean solutions can be found using k-medians and k-medoids.

The problem is computationally difficult (NP-hard); however, efficient heuristic algorithms converge quickly to a local optimum. These are usually similar to the expectation-maximization algorithm for mixtures of Gaussian distributions via an iterative refinement approach employed by both k-means and Gaussian mixture modeling. They both use cluster centers to model the data; however, k-means clustering tends to find clusters of comparable spatial extent, while the Gaussian mixture model allows clusters to have different shapes.

The unsupervised k-means algorithm has a loose relationship to the k-nearest neighbor classifier, a popular supervised machine learning technique for classification that is often confused with k-means due to the name. Applying the 1-nearest neighbor classifier to the cluster centers obtained by k-means classifies new data into the existing clusters. This is known as nearest centroid classifier or Rocchio algorithm.","K-means clustering is a vector quantization method that partitions observations into clusters based on their proximity to cluster centroids, optimizing within-cluster variances. Despite being computationally difficult, efficient heuristic algorithms converge quickly to a local optimum, resembling the expectation-maximization algorithm, and it's distinct from the k-nearest neighbor classifier, though it can be applied similarly for classification tasks."
"Reinforcement learning (RL) is a machine learning (ML) technique that trains software to make decisions to achieve the most optimal results. It mimics the trial-and-error learning process that humans use to achieve their goals. Software actions that work towards your goal are reinforced, while actions that detract from the goal are ignored. 

RL algorithms use a reward-and-punishment paradigm as they process data. They learn from the feedback of each action and self-discover the best processing paths to achieve final outcomes. The algorithms are also capable of delayed gratification. The best overall strategy may require short-term sacrifices, so the best approach they discover may include some punishments or backtracking along the way. RL is a powerful method to help artificial intelligence (AI) systems achieve optimal outcomes in unseen environments.","Reinforcement learning is a machine learning technique where software learns to make decisions through trial-and-error, utilizing a reward-and-punishment paradigm to discover optimal strategies even if they involve short-term sacrifices, ultimately helping AI systems achieve optimal outcomes in novel environments."
"Supervised learning is a category of machine learning that uses labeled datasets to train algorithms to predict outcomes and recognize patterns. Unlike unsupervised learning, supervised learning algorithms are given labeled training to learn the relationship between the input and the outputs. 

Supervised machine learning algorithms make it easier for organizations to create complex models that can make accurate predictions. As a result, they are widely used across various industries and fields, including healthcare, marketing, financial services, and more. ","Supervised learning, utilizing labeled datasets to train algorithms for predicting outcomes and identifying patterns, is extensively employed across diverse industries due to its capability in creating accurate predictive models."
"Abstraction is the concept of hiding the internal details and describing things in simple terms. For example, a method that adds two integers. The internal processing of the method is hidden from the outer world. There are many ways to achieve abstraction in object-oriented programmings, such as encapsulation and inheritance. A Java program is also a great example of abstraction. Here java takes care of converting simple statements to machine language and hides the inner implementation details from the outer world.","Abstraction in object-oriented programming involves concealing internal complexities and presenting simplified descriptions, exemplified by methods like addition of integers, encapsulation, inheritance, and Java's ability to mask implementation details while converting statements to machine language."
"Data has become the cornerstone of decision-making for businesses across industries. Over the years, data analytics has evolved from merely describing past events to predicting future outcomes, ushering in a new era of proactive decision-making and strategic planning.

At its nascent stage, data analytics primarily focused on descriptive analytics, which involved analyzing historical data to understand what happened in the past. While descriptive analytics provided valuable insights into past performance and trends, it lacked the ability to anticipate future events or outcomes.

However, with advancements in technology and the proliferation of big data, the field of data analytics has evolved to encompass predictive analytics. Predictive analytics leverages statistical algorithms, machine learning techniques, and artificial intelligence to forecast future trends, behaviors, and outcomes based on historical data patterns. By harnessing the power of predictive analytics, businesses can gain a competitive edge by anticipating market trends, customer behavior, and potential risks. Whether it’s optimizing marketing campaigns, forecasting demand, or mitigating risks, predictive analytics empowers organizations to make informed decisions and take proactive measures to stay ahead of the curve.

As we continue to witness rapid advancements in data analytics technologies, the journey from descriptive to predictive analytics represents a paradigm shift in how businesses harness data to drive innovation, optimize operations, and unlock new opportunities for growth. Embracing predictive analytics is not just about understanding the future; it’s about shaping it.","The evolution from descriptive to predictive analytics signifies a transformative shift in leveraging data for proactive decision-making, enabling businesses to anticipate future outcomes and gain a competitive edge in various facets of operation."
"Cybersecurity is the practice of protecting internet-connected systems such as hardware, software and data from cyberthreats. It's used by individuals and enterprises to protect against unauthorized access to data centers and other computerized systems.

An effective cybersecurity strategy can provide a strong security posture against malicious attacks designed to access, alter, delete, destroy or extort an organization's or user's systems and sensitive data. Cybersecurity is also instrumental in preventing attacks designed to disable or disrupt a system's or device's operations.

An ideal cybersecurity approach should have multiple layers of protection across any potential access point or attack surface. This includes a protective layer for data, software, hardware and connected networks. In addition, all employees within an organization who have access to any of these endpoints should be trained on the proper compliance and security processes. Organizations also use tools such as unified threat management systems as another layer of protection against threats. These tools can detect, isolate and remediate potential threats and notify users if additional action is needed.","Cybersecurity encompasses protecting internet-connected systems from cyberthreats through multiple layers of defense, including safeguarding data, software, hardware, and networks, while also emphasizing employee training and utilizing unified threat management systems for threat detection and remediation."
"Network security is defined as the activity created to protect the integrity of your network and data. Every company or organization that handles a large amount of data, has a degree of solutions against many cyber threats. 

Any action intended to safeguard the integrity and usefulness of your data and network is known as network security. This is a broad, all-encompassing phrase that covers software and hardware solutions, as well as procedures, guidelines, and setups for network usage, accessibility, and general threat protection.

The most basic example of Network Security is password protection which the user of the network chooses. In recent times, Network Security has become the central topic of cyber security with many organizations inviting applications from people who have skills in this area. The network security solutions protect various vulnerabilities of the computer systems such as:

Users
Locations
Data
Devices
Applications","Network security involves implementing measures to protect the integrity and accessibility of data and networks, encompassing a range of software, hardware, procedures, and guidelines to mitigate cyber threats and vulnerabilities."
"Linear regression is a type of supervised machine learning algorithm that computes the linear relationship between the dependent variable and one or more independent features by fitting a linear equation to observed data.

When there is only one independent feature, it is known as Simple Linear Regression, and when there are more than one feature, it is known as Multiple Linear Regression.

Similarly, when there is only one dependent variable, it is considered Univariate Linear Regression, while when there are more than one dependent variables, it is known as Multivariate Regression.

Why Linear Regression is Important?
The interpretability of linear regression is a notable strength. The model’s equation provides clear coefficients that elucidate the impact of each independent variable on the dependent variable, facilitating a deeper understanding of the underlying dynamics. Its simplicity is a virtue, as linear regression is transparent, easy to implement, and serves as a foundational concept for more complex algorithms.

Linear regression is not merely a predictive tool; it forms the basis for various advanced models. Techniques like regularization and support vector machines draw inspiration from linear regression, expanding its utility. Additionally, linear regression is a cornerstone in assumption testing, enabling researchers to validate key assumptions about the data.","Linear regression, whether simple or multiple, univariate or multivariate, is a foundational supervised machine learning algorithm that computes the linear relationship between dependent and independent variables, offering interpretability, simplicity, and serving as the basis for more complex models and assumption testing in data analysis."
"What is the best Fit Line?
Our primary objective while using linear regression is to locate the best-fit line, which implies that the error between the predicted and actual values should be kept to a minimum. There will be the least error in the best-fit line.

The best Fit Line equation provides a straight line that represents the relationship between the dependent and independent variables. The slope of the line indicates how much the dependent variable changes for a unit change in the independent variable(s).

Here Y is called a dependent or target variable and X is called an independent variable also known as the predictor of Y. There are many types of functions or modules that can be used for regression. A linear function is the simplest type of function. Here, X may be a single feature or multiple features representing the problem.

Linear regression performs the task to predict a dependent variable value (y) based on a given independent variable (x)). Hence, the name is Linear Regression. In the figure above, X (input) is the work experience and Y (output) is the salary of a person. The regression line is the best-fit line for our model. 

We utilize the cost function to compute the best values in order to get the best fit line since different values for weights or the coefficient of lines result in different regression lines.","The best-fit line in linear regression minimizes the error between predicted and actual values, representing the relationship between dependent and independent variables through a straight line equation, determined by optimizing weights or coefficients using a cost function."
"Assumptions of Simple Linear Regression
Linear regression is a powerful tool for understanding and predicting the behavior of a variable, however, it needs to meet a few conditions in order to be accurate and dependable solutions. 

Linearity: The independent and dependent variables have a linear relationship with one another. This implies that changes in the dependent variable follow those in the independent variable(s) in a linear fashion. This means that there should be a straight line that can be drawn through the data points. If the relationship is not linear, then linear regression will not be an accurate model.

Independence: The observations in the dataset are independent of each other. This means that the value of the dependent variable for one observation does not depend on the value of the dependent variable for another observation. If the observations are not independent, then linear regression will not be an accurate model.
Homoscedasticity: Across all levels of the independent variable(s), the variance of the errors is constant. This indicates that the amount of the independent variable(s) has no impact on the variance of the errors. If the variance of the residuals is not constant, then linear regression will not be an accurate model.

Normality: The residuals should be normally distributed. This means that the residuals should follow a bell-shaped curve. If the residuals are not normally distributed, then linear regression will not be an accurate model.","The assumptions of simple linear regression include linearity between independent and dependent variables, independence of observations, homoscedasticity (constant variance of errors across all levels of independent variables), and normality of residuals distribution for accurate and dependable predictions."
"Assumptions of Multiple Linear Regression
For Multiple Linear Regression, all four of the assumptions from Simple Linear Regression apply. In addition to this, below are few more:


No multicollinearity: There is no high correlation between the independent variables. This indicates that there is little or no correlation between the independent variables. Multicollinearity occurs when two or more independent variables are highly correlated with each other, which can make it difficult to determine the individual effect of each variable on the dependent variable. If there is multicollinearity, then multiple linear regression will not be an accurate model.
Additivity: The model assumes that the effect of changes in a predictor variable on the response variable is consistent regardless of the values of the other variables. This assumption implies that there is no interaction between variables in their effects on the dependent variable.
Feature Selection: In multiple linear regression, it is essential to carefully select the independent variables that will be included in the model. Including irrelevant or redundant variables may lead to overfitting and complicate the interpretation of the model.
Overfitting: Overfitting occurs when the model fits the training data too closely, capturing noise or random fluctuations that do not represent the true underlying relationship between variables. This can lead to poor generalization performance on new, unseen data.
","For Multiple Linear Regression, in addition to the assumptions of Simple Linear Regression, it's crucial to ensure no multicollinearity between independent variables, maintain additivity implying consistent effects regardless of other variables, carefully select relevant features to avoid overfitting, and prevent high correlation between predictors to maintain model accuracy and interpretation clarity."
"Linear Regression Line
The linear regression line provides valuable insights into the relationship between the two variables. It represents the best-fitting line that captures the overall trend of how a dependent variable (Y) changes in response to variations in an independent variable (X).

Positive Linear Regression Line: A positive linear regression line indicates a direct relationship between the independent variable (X) and the dependent variable (Y). This means that as the value of X increases, the value of Y also increases. The slope of a positive linear regression line is positive, meaning that the line slants upward from left to right.
Negative Linear Regression Line: A negative linear regression line indicates an inverse relationship between the independent variable (X) and the dependent variable (Y). This means that as the value of X increases, the value of Y decreases. The slope of a negative linear regression line is negative, meaning that the line slants downward from left to right.","The linear regression line depicts the relationship between two variables, with a positive slope indicating a direct relationship where increasing X leads to increasing Y, while a negative slope indicates an inverse relationship where increasing X leads to decreasing Y."
"Advantages of Linear Regression
Linear regression is a relatively simple algorithm, making it easy to understand and implement. The coefficients of the linear regression model can be interpreted as the change in the dependent variable for a one-unit change in the independent variable, providing insights into the relationships between variables.
Linear regression is computationally efficient and can handle large datasets effectively. It can be trained quickly on large datasets, making it suitable for real-time applications.
Linear regression is relatively robust to outliers compared to other machine learning algorithms. Outliers may have a smaller impact on the overall model performance.
Linear regression often serves as a good baseline model for comparison with more complex machine learning algorithms.
Linear regression is a well-established algorithm with a rich history and is widely available in various machine learning libraries and software packages.","The advantages of linear regression include its simplicity, interpretability of coefficients, computational efficiency with large datasets, robustness to outliers, usefulness as a baseline model, and wide availability in machine learning libraries and software packages."
"Disadvantages of Linear Regression
Linear regression assumes a linear relationship between the dependent and independent variables. If the relationship is not linear, the model may not perform well.
Linear regression is sensitive to multicollinearity, which occurs when there is a high correlation between independent variables. Multicollinearity can inflate the variance of the coefficients and lead to unstable model predictions.
Linear regression assumes that the features are already in a suitable form for the model. Feature engineering may be required to transform features into a format that can be effectively used by the model.
Linear regression is susceptible to both overfitting and underfitting. Overfitting occurs when the model learns the training data too well and fails to generalize to unseen data. Underfitting occurs when the model is too simple to capture the underlying relationships in the data.
Linear regression provides limited explanatory power for complex relationships between variables. More advanced machine learning techniques may be necessary for deeper insights.
ChatGPT","The disadvantages of linear regression include its assumption of a linear relationship between variables, sensitivity to multicollinearity leading to unstable predictions, requirement for feature engineering, susceptibility to both overfitting and underfitting, and limited explanatory power for complex relationships, necessitating the use of more advanced techniques for deeper insights."
"What is Logistic Regression?
Logistic regression is used for binary classification where we use sigmoid function, that takes input as independent variables and produces a probability value between 0 and 1.

For example, we have two classes Class 0 and Class 1 if the value of the logistic function for an input is greater than 0.5 (threshold value) then it belongs to Class 1 it belongs to Class 0. It’s referred to as regression because it is the extension of linear regression but is mainly used for classification problems.

Key Points:
Logistic regression predicts the output of a categorical dependent variable. Therefore, the outcome must be a categorical or discrete value.
It can be either Yes or No, 0 or 1, true or False, etc. but instead of giving the exact value as 0 and 1, it gives the probabilistic values which lie between 0 and 1.
In Logistic regression, instead of fitting a regression line, we fit an “S” shaped logistic function, which predicts two maximum values (0 or 1).
","Logistic regression is a classification algorithm used for binary classification tasks, employing a sigmoid function to produce probability values between 0 and 1, determining class membership based on a threshold (usually 0.5), and is an extension of linear regression with an ""S""-shaped logistic function to predict categorical outcomes."
